{
 "id": "JJJJ-MM-TT-trend",
 "aufgestellt": "JJJJ-MM-TTThh:mm",
 "stichtag": "JJJJ-MM-TTT17:00",
 "art": "eroeffnung",
 "frage": "Laeuft der Nasdaq heute ab 15:30 mindestens 200 Ticks in eine Richtung, bevor er 100 Ticks in die Gegenrichtung laeuft?",
 "p": 0.52,
 "grundrate": 0.52,
 "aufloesungsregel": "Bezugspunkt ist der Eroeffnungskurs der Minutenkerze 15:30 im Nasdaq-100-Future (NQ, fortlaufender Kontrakt, Zeitzone Europe/Berlin). Eingetreten, wenn der Kurs bis 17:00 Uhr in einer der beiden Richtungen 200 Ticks (50,00 Punkte) vom Bezugspunkt erreicht, ohne vorher in der Gegenrichtung 100 Ticks (25,00 Punkte) erreicht zu haben. Gemessen werden Hoch und Tief der Minutenkerzen; eine Beruehrung genuegt, ein Schluss ist nicht noetig. Enthaelt dieselbe Minutenkerze beide Marken, laesst sich die Reihenfolge nicht feststellen und die Richtung gilt als gescheitert. Ob ich gehandelt habe, spielt keine Rolle - es zaehlt allein der Kursverlauf. Wird bis 17:00 Uhr keine der beiden 200er-Marken erreicht, gilt die Aussage als nicht eingetreten.",
 "quelle": "Minutendaten des NQ-Future, nachpruefbar in jedem Chart",
 "konsens": "Grundrate 52% - 26 von 50 Sessions, 06.07.-11.09.2026. Vertrauensintervall 0,39 bis 0,65",
 "begruendung": "Was heute auffaellt. Was ich glaube. Was dagegen spricht und ob ich es gemessen habe. Warum diese Hoehe."
}
