{
 "id": "2026-09-14-open",
 "aufgestellt": "2026-09-14T15:06",
 "stichtag": "2026-09-14T15:40",
 "art": "eroeffnung",
 "frage": "Entsteht heute zwischen 15:30 und 15:40 ein regelkonformes Setup nach Version 2.0?",
 "p": 0.32,
 "grundrate": 0.32,
 "aufloesungsregel": "Eingetreten, wenn zwischen 15:30 und 15:40 Uhr MESZ mindestens eine M1-Kerze mindestens 8 Ticks jenseits eines vor 15:30 markierten Levels schliesst, die Richtung dem Cash-Open-Filter entspricht und der Kurs beim Schluss dieser Kerze nicht mehr als 80 Ticks von diesem Level entfernt ist. Ein Schluss exakt auf der Linie zaehlt als nicht eingetreten. Ob ich tatsaechlich eingestiegen bin, spielt keine Rolle - es zaehlen allein die Bedingungen. Massgeblich ist die Erstaufzeichnung im eigenen Chart, festgehalten im Review derselben Session; spaetere Korrekturen bleiben unberuecksichtigt.",
 "quelle": "eigener Chart, Review derselben Session",
 "konsens": "Grundrate 32%, gemessen ueber 50 Sessions (06.07.-11.09.2026)",
 "begruendung": "Der Markt hat heute mit einem Gap aus dem Wochenende eröffnet. Gaps machen die Cash Open nach meiner Erfahrung schwieriger: Der Kurs chopt im Gap, und die Levels aus der Vorbereitung liegen nicht mehr dort, wo tatsächlich gehandelt wird. Von 9:00 bis 11:00 lief eine Short-Struktur über rund 600 Ticks. Die Seite ist damit klar — Long ist für mich heute als Momentum-Trade ausgeschlossen, weil es die schwache Seite ist und dort kein tragfähiges Momentum zustande kommt. Für Short gilt die Einschränkung, dass nur ein Einstieg am Tagestief taugt, nicht am Tageshoch: Im Gap ziehen starke Ablehnungen, und ein Trend mit großen Pullbacks gibt keine sauberen Swings. Ich setze deshalb ___ statt der Grundrate von 0,32. Dagegen spricht, dass ich den Zusammenhang zwischen Gap-Eröffnungen und Setup-Häufigkeit bisher nur beobachtet und nicht gemessen habe; in meinen 50 ausgewerteten Sessions sind zu wenige Gap-Tage, um das zu belegen. Weiter von der Grundrate weg gehe ich deshalb nicht."
}
