{
 "id": "2026-09-12-zew-september",
 "aufgestellt": "2026-09-12T11:21",
 "stichtag": "2026-09-15T11:00",
 "art": "stimmung",
 "frage": "Liegt der ZEW-Index der Konjunkturerwartungen für Deutschland im September 2026 über der Konsensschätzung?",
 "p": 0.55,
 "grundrate": 0.5,
 "aufloesungsregel": "Eingetreten, wenn der vom ZEW am 15.09.2026 um 11:00 Uhr veröffentlichte Saldo der Konjunkturerwartungen für Deutschland über 34,0 Punkten liegt. Exakt 34,0 zählt als nicht eingetreten. Maßgeblich ist die Erstveröffentlichung; spätere Revisionen bleiben unberücksichtigt.",
 "quelle": "ZEW – Leibniz-Zentrum für Europäische Wirtschaftsforschung, Mannheim",
 "konsens": "34,0 Punkte (Trading Economics, abgerufen 12.09.2026)",
 "begruendung": "Der Konsens liegt bei 34,0 und damit fast genau auf dem Augustwert, obwohl der Index im August stark gestiegen ist. Ich glaube, dass die Prognostiker nach so einem Sprung zu vorsichtig sind und am alten Wert hängen bleiben. Dagegen spricht, dass es nach starken Anstiegen oft wieder runtergeht, und ich habe meine Vermutung noch nie nachgerechnet. Darum nur 0.55 und nicht mehr. Die Schwelle von 34,0 Punkten entspricht dem Konsens vom 12.09.2026 und bleibt unveraendert, auch wenn sich die Erwartung bis zum Stichtag verschiebt."
}
